{
  "edges": [
    {
      "confidence": 1,
      "id": "tests-service",
      "kind": "tests",
      "source": "service-tests",
      "source_refs": [
        {
          "kind": "git_commit",
          "ref": "1111111111111111111111111111111111111111"
        }
      ],
      "status": "observed",
      "target": "service-source",
      "weight": 1
    }
  ],
  "generated_at": "2026-07-24T00:06:00Z",
  "hypotheses": [
    {
      "blocking": true,
      "claim": "The service is governed as one delivery boundary.",
      "evidence": [
        {
          "kind": "file",
          "ref": "src/service.py"
        }
      ],
      "graph_delta": [
        {
          "op": "confirm",
          "target_id": "service-source",
          "target_kind": "node"
        },
        {
          "op": "confirm",
          "target_id": "service-tests",
          "target_kind": "node"
        },
        {
          "op": "confirm",
          "target_id": "tests-service",
          "target_kind": "edge"
        },
        {
          "op": "confirm",
          "target_id": "service-delivery-boundary",
          "target_kind": "hypothesis"
        }
      ],
      "id": "service-delivery-boundary",
      "impact_score": 1,
      "status": "unresolved"
    }
  ],
  "id": "generic-service",
  "kind": "concordloom.project-graph",
  "nodes": [
    {
      "category": "source",
      "confidence": 1,
      "id": "service-source",
      "kind": "component",
      "label": "Service source",
      "provenance": [
        {
          "kind": "file",
          "ref": "src/service.py"
        }
      ],
      "status": "observed"
    },
    {
      "category": "test",
      "confidence": 1,
      "id": "service-tests",
      "kind": "component",
      "label": "Service tests",
      "provenance": [
        {
          "kind": "file",
          "ref": "tests/test_service.py"
        }
      ],
      "status": "observed"
    }
  ],
  "phase": "observed",
  "repository": {
    "dirty": false,
    "history_head": "1111111111111111111111111111111111111111",
    "id": "generic-service",
    "revision": "1111111111111111111111111111111111111111",
    "tree_digest": "sha256:aaaaaaaaaaaaaaaaaaaaaaaaaaaaaaaaaaaaaaaaaaaaaaaaaaaaaaaaaaaaaaaa"
  },
  "schema_version": "0.1"
}
